# This is a tab delimited spreadsheet (TSV) for all Heimdall messages.			
# The message levels are best practice (b), info (i), warning (w), and error (e)			
code	label	description	url
e1	Missing suite folders	All suites require the folders: ‘listings’, ‘sequencing’, ‘stats’, and ‘logs’. This suite is missing: {folders}	https://wiki.cmc.ec.gc.ca/wiki/Maestro_Files_and_Folders
e2	No EntryModule	EntryModule link does not exist: ‘{entry_module}’	https://wiki.cmc.ec.gc.ca/wiki/EntryModule
e3	Bad EntryModule	EntryModule is not a link: ‘{entry_module}’	https://wiki.cmc.ec.gc.ca/wiki/EntryModule
e4	No experiment here	Could not find an experiment for path: '{path}'. A valid experiment folder contains an 'EntryModule' link.	https://wiki.cmc.ec.gc.ca/wiki/EntryModule
